{
  "schema": "spec2exec.semantic-candidate/v0.1",
  "candidate_id": "PAY-CANDIDATE-ACCEPTED",
  "requirement_id": "PAY-RETRY-001",
  "proposer": "ai-coding-agent-demo",
  "values": {
    "retry_count": 3,
    "retry_on_http_500": true,
    "retry_on_timeout": false,
    "backoff_policy": "exponential",
    "request_timeout_ms": 2000,
    "idempotency_requirement": true,
    "terminal_failure_behavior": "surface_failure"
  },
  "provenance": {
    "retry_count": {"source_artifact":"examples/payment-retry/requirement.json","source_requirement_id":"PAY-RETRY-001","source_locator":"/text","origin":"ai-proposal","source_supports_value":false},
    "retry_on_http_500": {"source_artifact":"examples/payment-retry/requirement.json","source_requirement_id":"PAY-RETRY-001","source_locator":"/text","origin":"ai-proposal","source_supports_value":false},
    "retry_on_timeout": {"source_artifact":"examples/payment-retry/requirement.json","source_requirement_id":"PAY-RETRY-001","source_locator":"/text","origin":"ai-proposal","source_supports_value":false},
    "backoff_policy": {"source_artifact":"examples/payment-retry/requirement.json","source_requirement_id":"PAY-RETRY-001","source_locator":"/text","origin":"ai-proposal","source_supports_value":false},
    "request_timeout_ms": {"source_artifact":"examples/payment-retry/requirement.json","source_requirement_id":"PAY-RETRY-001","source_locator":"/text","origin":"ai-proposal","source_supports_value":false},
    "idempotency_requirement": {"source_artifact":"examples/payment-retry/requirement.json","source_requirement_id":"PAY-RETRY-001","source_locator":"/text","origin":"semantic-obligation","source_supports_value":false},
    "terminal_failure_behavior": {"source_artifact":"examples/payment-retry/requirement.json","source_requirement_id":"PAY-RETRY-001","source_locator":"/text","origin":"ai-proposal","source_supports_value":false}
  }
}
